"","name","count"
"640","per serving calories g protein",4
"641","protein g carbohydrate g g",5
"642","saturated mg cholesterol mg sodium",4
"643","serving calories g protein g",4
"644","the city council will consider",2
"645","calories calories percent total calories",2
"646","calories g g saturated g",2
"647","calories percent total calories g",2
"648","carbohydrate g protein g fiber",2
"649","cholesterol g carbohydrate g protein",2
"650","fats mg cholesterol g carbohydrate",2
"651","g carbohydrate g protein g",2
"652","g g saturated g trans",2
"653","g protein g fiber mg",2
"654","g saturated g trans fats",2
"655","g trans fats mg cholesterol",2
"656","mg cholesterol g carbohydrate g",2
"657","percent total calories g g",2
"658","protein g fiber mg sodium",2
"659","saturated g trans fats mg",2
"660","total calories g g saturated",2
"661","trans fats mg cholesterol g",2
"662","– a burglary reported block",2
"663","peg leg hastings lenny henry",2
"664","missouri department elementary secondary education",2
"665","hudson county prosecutor edward defazio",2
"666","the dow jones industrial average",4
"667","the american civil liberties union",2
"668","author the practical nomad how",2
"669","edward hasbrouck industry watcher author",2
"670","hasbrouck industry watcher author the",2
"671","industry lobbying likely little value",2
"672","industry watcher author the practical",2
"673","likely little value says edward",2
"674","little value says edward hasbrouck",2
"675","lobbying likely little value says",2
"676","nomad how travel around world",2
"677","practical nomad how travel around",2
"678","says edward hasbrouck industry watcher",2
"679","some seemingly proconsumer provisions bill",2
"680","the practical nomad how travel",2
"681","value says edward hasbrouck industry",2
"682","watcher author the practical nomad",2
"683","lake oswego public library fourth",2
"684","library fourth st lake oswego",2
"685","oswego public library fourth st",2
"686","public library fourth st lake",2
"687","new jersey gov chris christie",2
"688","if you can get it",2
"689","nice work if you can",2
"690","work if you can get",2
"691","dow jones industrial average rose",2
"692","jones industrial average rose points",2
"693","israeli prime minister benjamin netanyahu",2
"694","university hospitals case medical center",2
"695","cents per share first quarter",2
"696","devon still dt penn state",2
"697","arizona high school sports hall",3
"698","high school sports hall fame",3
"699","the change will take effect",2
"700","new orleans head coach sean",2
"701","orleans head coach sean payton",2
"702","national weather service issued winter",2
"703","the national weather service issued",2
"704","weather service issued winter storm",2
"705","st charles for information contact",2
"706","county executive joseph divincenzo jr",2
"707","executive joseph divincenzo jr said",2
"708","death experience attending funeral sunday",2
"709","mandatory drug treatment nonviolent offenders",2
"710","resolve set mandatory drug treatment",2
"711","set mandatory drug treatment nonviolent",2
"712","i like able fire people",2
"713","knew like worry pinkslipped job",2
"714","short stop w sunset blvd",2
"715","stop w sunset blvd los",2
"716","w sunset blvd los angeles",2
"717","i recognize many americans tired",2
"718","recognize many americans tired war",2
"719","started afghanistan end war responsibly",2
"720","error plus minus percentage points",3
"721","margin error plus minus percentage",3
"722","los angeles memorial coliseum commission",2
"723","authority new york new jersey",2
"724","port authority new york new",2
"725","business network international st charles",3
"726","charles coffee house mcclay road",2
"727","coffee house mcclay road st",2
"728","for information contact joseph ord",2
"729","house mcclay road st peters",2
"730","international st charles west chapter",2
"731","mcclay road st peters for",2
"732","network international st charles west",2
"733","peters for information contact joseph",2
"734","road st peters for information",2
"735","st charles coffee house mcclay",2
"736","st peters for information contact",2
"737","vorys sater seymour pease llp",2
"738","the centers disease control prevention",2
"739","house committee oversight government reform",2
"740","the event free open public",2
"741","minutes remove heat set aside",2
"742","england patriots quarterback tom brady",2
"743","new england patriots quarterback tom",2
"744","cup calories g protein g",2
"745","g saturated cholesterol mg sodium",2
"746","per cup calories g protein",2
"747","saturated cholesterol mg sodium g",2
"748","to reach plain dealer reporter",3
"749","county prosecutor marlene lynch ford",2
"750","ocean county prosecutor marlene lynch",2
"751","prosecutor marlene lynch ford said",2
"752","assistant us attorney antoinette bacon",2
"753","former massachusetts gov mitt romney",2
"754","cuyahoga county commissioner jimmy dimora",3
"755","former cuyahoga county commissioner jimmy",3
"756","federal reserve chairman ben bernanke",2
"757","reserve chairman ben bernanke said",2
"758","change plane restricted roundtrip fares",2
"759","connecting service change plane restricted",2
"760","direct service stop change plane",2
"761","offer connecting service change plane",2
"762","plane restricted roundtrip fares begin",2
"763","service change plane restricted roundtrip",2
"764","azcentralcoms arizona high school sports",2
"765","abroad economic crisis home time",2
"766","as emerge decade conflict abroad",2
"767","conflict abroad economic crisis home",2
"768","decade conflict abroad economic crisis",2
"769","economic crisis home time renew",2
"770","emerge decade conflict abroad economic",2
"771","superior court judge glenn berman",2
"772","share analysts polled thomson reuters",2
"773","national highway traffic safety administration",2
"774","presumptive republican nominee mitt romney",2
"775","institute supply management said tuesday",2
"776","said jefferson county sheriffs capt",2
"777","college courses helped best prepare",2
"778","courses helped best prepare current",2
"779","during high school college courses",2
"780","helped best prepare current position",2
"781","high school college courses helped",2
"782","school college courses helped best",2
"783","michael miller vice president american",2
"784","miller vice president american aviation",2
"785","says michael miller vice president",2
"786","vice president american aviation institute",2
"787","first reported the associated press",2
"788","gov chris christie said today",2
"789","“the girl with dragon tattoo”",2
"790","director new jersey sierra club",2
"791","new jersey sierra club said",2
"792","essex county prosecutor’s office said",2
"793","i dont call pressure i",2
"794","cardinal glennon childrens medical center",2
"795","glennon childrens medical center doctors",2
"796","gov andrew cuomo new york",2
"797","caused gasp air according complaint",2
"798","chokehold caused gasp air according",2
"799","hill pulled sofa dragged toward",2
"800","hill put chokehold caused gasp",2
"801","put chokehold caused gasp air",2
"802","oklahoma state receiver justin blackmon",2
"803","branch library n main st",2
"804","deer run branch library n",2
"805","library n main st ofallon",2
"806","run branch library n main",2
"807","actual deductions start oct along",2
"808","along health benefits contribution hikes",2
"809","deductions start oct along health",2
"810","however actual deductions start oct",2
"811","oct along health benefits contribution",2
"812","pension changes took effect july",2
"813","start oct along health benefits",2
"814","weather service office weldon spring",3
"815","committed suicide jumping george washington",2
"816","suicide jumping george washington bridge",2
"817","announced russia china merely veto",2
"818","china merely veto international actions",2
"819","chooses obama announced russia china",2
"820","client chooses obama announced russia",2
"821","extend protective umbrella whichever murderous",2
"822","international legitimacy nothing allow russia",2
"823","mindless selfsubordination international legitimacy nothing",2
"824","murderous client chooses obama announced",2
"825","obama announced russia china merely",2
"826","our slavish mindless selfsubordination international",2
"827","protective umbrella whichever murderous client",2
"828","russia china merely veto international",2
"829","sanctions military assistance direct intervention",2
"830","selfsubordination international legitimacy nothing allow",2
"831","slavish mindless selfsubordination international legitimacy",2
"832","umbrella whichever murderous client chooses",2
"833","whichever murderous client chooses obama",2
"834","averaging points rebounds per game",2
"835","county executive charlie a dooley",2
"836","hours pm sunday thursday pm",2
"837","pm sunday thursday pm friday",2
"838","sunday thursday pm friday saturday",2
"839","sales rose percent million million",2
"840","secretary state hillary rodham clinton",2
"841","newark archbishop john j myers",2
"842","national weather service office weldon",2
"843","rock roll hall fame induction",2
"844","said rep tom price rga",2
"845","response register public records request",2
"846","cash squarefoot home pool built",2
"847","paid cash squarefoot home pool",2
"848","the institute supply management said",2
"849","economy accelerate government foot brake",2
"850","hard economy accelerate government foot",2
"851","its hard economy accelerate government",2
"852","joel naroff president naroff economic",2
"853","naroff president naroff economic advisors",2
"854","we need talk about kevin",2
"855","see light new day horizon",2
"856","traveled decade dark cloud war",2
"857","net income million per share",2
"858","i just tried keep ball",2
"859","bogey hills country club country",2
"860","club country club road st",2
"861","country club country club road",2
"862","country club road st charles",2
"863","hills country club country club",2
"864","died thursday dove funeral home",2
"865","orlando died thursday dove funeral",2
"866","thursday dove funeral home orlando",2
"867","total offense yards per game",2
"868","cuyahoga county executive ed fitzgerald",2
"869","i think boy i think",2
"870","think boy i think kids",2
"871","advancing issues outnumbered decliners new",2
"872","decliners new york stock exchange",2
"873","exchange volume came million shares",2
"874","issues outnumbered decliners new york",2
"875","new york stock exchange volume",2
"876","outnumbered decliners new york stock",2
"877","stock exchange volume came million",2
"878","york stock exchange volume came",2
"879","saturday night mostly clear low",2
"880","difficult estimate variables include type",2
"881","estimate variables include type food",2
"882","vary difficult estimate variables include",2
"883","county prosecutor bruce kaplan said",2
"884","middlesex county prosecutor bruce kaplan",2
"885","th us circuit court appeals",2
"886","south korean president lee myungbak",2
"887","sen dianne feinstein dcalif rep",2
"888","said agents executed search warrant",2
"889","the girl with dragon tattoo",2
"890","the levees built s s",2
"891","anniversary killing osama bin laden",2
"892","oneyear anniversary killing osama bin",2
"893","life prison without possibility parole",2
"894","us treasury secretary timothy geithner",2
"895","hearts prayers go family friends",2
"896","diego state running back ronnie",2
"897","san diego state running back",2
"898","state running back ronnie hillman",2
"899","bar reservations credit cards accepted",2
"900","full bar reservations credit cards",2
"901","portland coach john spencer said",2
"902","percent overall percent point range",2
"903","north american electric reliability corp",2
"904","said dan mogulof university spokesman",2
"905","britons exposed griefstricken ordinary people",2
"906","cellphone yearold dowler — found",2
"907","claim tabloid listened interfered messages",2
"908","exposed griefstricken ordinary people addition",2
"909","griefstricken ordinary people addition celebrities",2
"910","interfered messages left cellphone yearold",2
"911","left cellphone yearold dowler —",2
"912","listened interfered messages left cellphone",2
"913","many britons exposed griefstricken ordinary",2
"914","messages left cellphone yearold dowler",2
"915","ordinary people addition celebrities politicians",2
"916","people addition celebrities politicians pursued",2
"917","tabloid listened interfered messages left",2
"918","the claim tabloid listened interfered",2
"919","cardinals manager mike matheny said",2
"920","emotional leader hometown san diego",2
"921","exwife knew might led former",2
"922","leader hometown san diego chargers",2
"923","mitchell seaus exwife knew might",2
"924","neither mitchell seaus exwife knew",2
"925","seaus exwife knew might led",2
"926","anterior cruciate ligament left knee",2
"927","hours pm monday saturday pm",2
"928","state sen jim whelan datlantic",2
"929","farmington hills police chief chuck",2
"930","hills police chief chuck nebus",2
"931","athletic director jerry bovee told",2
"932","bovee told the salt lake",2
"933","director jerry bovee told the",2
"934","good time hire new football",2
"935","jerry bovee told the salt",2
"936","state athletic director jerry bovee",2
"937","told the salt lake tribune",2
"938","weber state athletic director jerry",2
"939","index smaller companies rose percent",2
"940","russell index smaller companies rose",2
"941","the russell index smaller companies",2
"942","chicago teachers union president karen",2
"943","teachers union president karen lewis",2
"944","told the new york times",2
"945","cholesterol mg dietary fiber g",2
"946","g cholesterol mg dietary fiber",2
"947","protein g cholesterol mg dietary",2
"948","arrested block madison avenue charge",2
"949","bisexual men heterosexual couples one",2
"950","contracting hiv including bisexual men",2
"951","high risk contracting hiv including",2
"952","hiv including bisexual men heterosexual",2
"953","including bisexual men heterosexual couples",2
"954","people high risk contracting hiv",2
"955","risk contracting hiv including bisexual",2
"956","arrested bench warrant saturday case",2
"957","bench warrant saturday case charged",2
"958","oregon coach chip kelly said",2
"959","treasury secretary timothy geithner said",2
"960","antiseizure moodstabilizing drug prescribed bipolar",2
"961","depakote antiseizure moodstabilizing drug prescribed",2
"962","moodstabilizing drug prescribed bipolar disorder",2
